{
  "pageId": "page-1",
  "chapterUrl": "chapter-1",
  "source": "WEBTOONS_EN",
  "width": 800,
  "height": 1200,
  "blocks": [
    {
      "id": "b1",
      "type": "dialogue",
      "bbox": {"x": 10, "y": 20, "w": 200, "h": 40},
      "originalText": "HELLO WORLD",
      "translatedText": "Bonjour le monde",
      "readingOrder": 0,
      "status": "ok",
      "confidence": 0.92
    }
  ]
}
